{
  "$schema": "http://json-schema.org/draft-07/schema#",
  "$id": "https://schemas.agent-orchestration.internal/execution_plan.schema.json",
  "title": "ExecutionPlanPayload",
  "description": "Canonical schema for machine-executable execution plans generated by the Planner Agent",
  "type": "object",
  "required": ["subtasks"],
  "properties": {
    "task_id": {
      "type": "string",
      "description": "Unique identifier for the task or issue",
      "example": "FEATURE-01"
    },
    "feature_name": {
      "type": "string",
      "description": "Slug or kebab-case name of the feature",
      "example": "wallet-deduction"
    },
    "blast_radius": {
      "type": "string",
      "enum": ["LOW", "MEDIUM", "HIGH"],
      "default": "LOW"
    },
    "reqspec_triage": {
      "type": "object",
      "description": "RULE-PLAN-006: planner decision whether /req-to-reqspec is required before planning. Fail-safe: when uncertain, REQUIRED.",
      "required": ["decision", "reasons"],
      "properties": {
        "decision": {
          "type": "string",
          "enum": ["SKIP", "REQUIRED"],
          "description": "SKIP = TRD serves dual duty as requirements spec (single context, FR/AC complete); REQUIRED = decompose PRD into docs/reqspecs/ first"
        },
        "bounded_contexts": {
          "type": "array",
          "items": { "type": "string" },
          "description": "Bounded contexts / top-level modules identified in the input"
        },
        "matrix_answers": {
          "type": "object",
          "description": "Blast Radius Assessment Matrix (spec_decomposition_rules.md §3.4)",
          "properties": {
            "db_schema": { "type": "string", "enum": ["yes", "no"] },
            "api_contract": { "type": "string", "enum": ["yes", "no"] },
            "multi_service": { "type": "string", "enum": ["yes", "no"] },
            "financial_integrity": { "type": "string", "enum": ["yes", "no"] }
          }
        },
        "reasons": {
          "type": "array",
          "minItems": 1,
          "items": { "type": "string" },
          "description": "Evidence-based justification for the decision (shown at Human Gate 2 for veto)"
        }
      }
    },
    "total_subtasks": {
      "type": "integer",
      "minimum": 1
    },
    "subtasks": {
      "type": "array",
      "minItems": 1,
      "items": {
        "$ref": "#/definitions/SubTask"
      }
    },
    "verification_commands": {
      "type": "array",
      "items": { "type": "string" },
      "description": "Global verification commands to run across the entire workspace"
    }
  },
  "definitions": {
    "SubTask": {
      "type": "object",
      "required": ["id", "name", "estimated_loc", "depends_on", "target_files"],
      "properties": {
        "id": {
          "type": "string",
          "description": "Unique subtask identifier",
          "example": "ST-01"
        },
        "name": {
          "type": "string",
          "description": "Concise human-readable title of the subtask"
        },
        "domain": {
          "type": "string",
          "description": "Bounded context or functional topic this subtask belongs to (RULE-PLAN-007 Single Responsibility Invariant)"
        },
        "pr_group": {
          "type": "string",
          "description": "Identifier of the target Pull Request grouping (e.g. PR-01, PR-AUTH-01) obeying RULE-PLAN-007"
        },
        "layer": {
          "type": "string",
          "enum": ["domain", "repository", "service", "transport", "adapter", "config", "test", "cross_cutting"],
          "description": "Clean Architecture layer targeted by this subtask"
        },
        "estimated_loc": {
          "type": "integer",
          "maximum": 500,
          "description": "Estimated lines of code (RULE-PLAN-004 hard limit <= 500 LOC per PR/subtask)"
        },
        "depends_on": {
          "type": "array",
          "items": { "type": "string" },
          "description": "Prerequisite subtask IDs in the execution DAG"
        },
        "test_cases": {
          "type": "array",
          "items": { "type": "string" },
          "description": "List of TC-xx scenarios satisfied by this subtask"
        },
        "target_files": {
          "type": "array",
          "minItems": 1,
          "items": { "type": "string" },
          "description": "Whitelist of files this subtask is permitted to touch"
        },
        "verification_command": {
          "type": "string",
          "description": "Targeted test/verification command for this subtask"
        }
      }
    }
  }
}
